{
  "ok": true,
  "execution_mode": "strict_model_workflow",
  "title": "为什么你的 AI 改稿越改越像模板",
  "platform": "wechat",
  "language": "zh",
  "status": "ready_for_human_review",
  "ai_slop_score": 18,
  "pass_score": 25,
  "round": 1,
  "main_problem": "原稿过度依赖词语替换，缺少读者现场和作者判断。",
  "issues": [],
  "rewrite_brief": "保留核心观点，补具体编辑现场，删掉泛化结尾。",
  "final_text": "示例正文略。",
  "rule_scan": {},
  "judge_result": {},
  "viral_judge_result": {
    "viral_score": 72,
    "hook_score": 75,
    "title_score": 78,
    "reader_mirror_score": 70,
    "tension_score": 74,
    "specificity_score": 65,
    "share_reason": "适合转发给正在使用 AI 改稿的作者和编辑。",
    "comment_trigger": "读者可以讨论自己最常见的 AI 味问题。",
    "main_viral_gap": "还可以补一个更具体的改稿前后对比。",
    "fix_brief": "强化前三行的编辑现场，并让标题承诺正文能够兑现。",
    "clickbait_risk": "low",
    "credibility_risk": "low"
  },
  "platform_output": {
    "title_options": ["为什么你的 AI 改稿越改越像模板", "别只删套话，AI 味真正藏在结构里", "改 AI 初稿前，先看这 3 个位置"],
    "summary": "一篇关于 AI 改稿和内容质检的公众号文章。",
    "body": "示例正文略。",
    "tags": [],
    "cover_prompt": "中文内容编辑工作台，文章上有批注和结构标记",
    "image_style": "editorial",
    "image_usage": "cover",
    "image_reason": "封面表达编辑审稿场景。",
    "hook_lines": ["很多 AI 初稿不是坏在词上。", "它坏在每句话都很顺，但没有一句需要作者负责。", "这也是为什么很多改稿越改越像模板。"],
    "share_trigger": "适合转发给正在写作和改稿的人。",
    "comment_trigger": "你最常见的 AI 味来自词、结构，还是例子？",
    "publish_notes": "发布前确认案例是否真实。",
    "files": []
  },
  "human_review_checklist": []
}
